{
  "id": "medical-research",
  "title": "📚 Medical Research Pipeline",
  "description": "Orthopaedics & digital health research management system focusing on shoulder arthroscopy trends, smartphone goniometry, and AI in medicine applications.",
  "completion": 60,
  "lastUpdated": "2026-02-11T07:42:00.000Z",
  "status": "active",
  "technologies": [
    "R",
    "tidyverse",
    "MASS",
    "broom",
    "segmented",
    "Statistical Modeling",
    "Data Analysis"
  ],
  "startDate": "2025-09-01",
  "repository": "https://github.com/alexherchen/medical-research-pipeline",
  "documentation": "https://alexherchen.dev/research"
}